{
  "id": "appliance",
  "version": "0.2.0",
  "displayName": "Appliance",
  "description": "Status surface for washers, dryers and similar household appliances.",
  "aiSummary": "Use when washer or dryer status/progress can be identified confidently.",
  "sizes": ["sm", "md"],
  "capabilities": [
    { "kind": "washer" },
    { "kind": "dryer" }
  ],
  "props": {
    "title": {
      "type": "string",
      "description": "Human-facing appliance name"
    }
  },
  "actions": [
    {
      "id": "start-stop",
      "description": "Start or stop an appliance only if the integration exposes an explicit safe service.",
      "risk": "control"
    }
  ]
}
